[
  {
    "id": "saa-001",
    "exam": "aws-solutions-architect-associate",
    "domain": "Design Resilient Architectures",
    "difficulty": "medium",
    "stem": "You need an Amazon RDS database to automatically fail over to a standby in another Availability Zone if the primary fails, with no application-side changes and synchronous replication. Which feature do you enable?",
    "options": [
      {
        "id": "o1",
        "text": "A Multi-AZ deployment"
      },
      {
        "id": "o2",
        "text": "A read replica in the same Availability Zone"
      },
      {
        "id": "o3",
        "text": "A larger instance class"
      },
      {
        "id": "o4",
        "text": "S3 Cross-Region Replication of the database files"
      }
    ],
    "correctAnswerId": "o1",
    "explanationCorrect": "Multi-AZ maintains a synchronously replicated standby in a second Availability Zone and fails over to it automatically using the same endpoint, so the application keeps using one address and needs no changes.",
    "explanationIncorrect": "A read replica is asynchronous and exists to scale read traffic; it is not an automatic failover target and would have to be promoted manually, losing the automation and risking data behind the primary. A larger instance class improves performance but does nothing for availability if that single instance's AZ fails. S3 Cross-Region Replication copies objects between buckets and is not a mechanism for RDS failover at all. Automatic, synchronous, cross-AZ standby with seamless failover is the Multi-AZ deployment.",
    "tags": [
      "resilience",
      "rds",
      "multi-az"
    ],
    "isSeed": true
  },
  {
    "id": "saa-016",
    "exam": "aws-solutions-architect-associate",
    "domain": "Design Resilient Architectures",
    "difficulty": "medium",
    "stem": "You want a web tier that automatically replaces failed instances and stays available even if an entire Availability Zone fails, while distributing traffic across healthy instances. Which combination achieves this?",
    "options": [
      {
        "id": "o1",
        "text": "An Auto Scaling group spanning multiple Availability Zones behind an Application Load Balancer"
      },
      {
        "id": "o2",
        "text": "A single large instance with a static Elastic IP"
      },
      {
        "id": "o3",
        "text": "One instance per Region with manual DNS switching"
      },
      {
        "id": "o4",
        "text": "A NAT gateway placed in front of the instances"
      }
    ],
    "correctAnswerId": "o1",
    "explanationCorrect": "An Auto Scaling group across multiple AZs replaces unhealthy instances and survives an AZ failure, and the load balancer spreads traffic only to healthy targets, giving both self-healing and high availability.",
    "explanationIncorrect": "A single instance is a single point of failure regardless of its Elastic IP. One instance per Region with manual DNS switching is slow and error-prone, not automatic. A NAT gateway provides outbound internet access for private subnets; it does not balance or heal the web tier. The resilient pattern is a multi-AZ Auto Scaling group behind a load balancer.",
    "tags": [
      "resilience",
      "auto-scaling",
      "load-balancing"
    ]
  },
  {
    "id": "saa-017",
    "exam": "aws-solutions-architect-associate",
    "domain": "Design Resilient Architectures",
    "difficulty": "medium",
    "stem": "You run a primary site and a standby site and want DNS to automatically direct users to the standby if the primary fails a health check. Which Route 53 feature does this?",
    "options": [
      {
        "id": "o1",
        "text": "Failover routing with health checks"
      },
      {
        "id": "o2",
        "text": "Simple routing"
      },
      {
        "id": "o3",
        "text": "Weighted routing with fixed weights"
      },
      {
        "id": "o4",
        "text": "A single CNAME pointing at both sites"
      }
    ],
    "correctAnswerId": "o1",
    "explanationCorrect": "Route 53 failover routing uses health checks to serve the primary while it is healthy and automatically switch DNS answers to the standby when the primary fails, which is the active-passive pattern described.",
    "explanationIncorrect": "Simple routing returns a fixed record with no health awareness, so it cannot fail over. Weighted routing splits traffic by proportion and does not by itself redirect on failure. A CNAME cannot point at two sites or perform health-based switching. Automatic health-based redirection is failover routing.",
    "tags": [
      "resilience",
      "route53",
      "failover"
    ]
  },
  {
    "id": "saa-018",
    "exam": "aws-solutions-architect-associate",
    "domain": "Design Resilient Architectures",
    "difficulty": "medium",
    "stem": "For disaster recovery you must automatically keep a copy of critical S3 objects in a second AWS Region. Which feature provides this?",
    "options": [
      {
        "id": "o1",
        "text": "S3 Cross-Region Replication (CRR)"
      },
      {
        "id": "o2",
        "text": "S3 Versioning within a single Region"
      },
      {
        "id": "o3",
        "text": "An EBS snapshot of the bucket"
      },
      {
        "id": "o4",
        "text": "A manual copy onto an EC2 local disk"
      }
    ],
    "correctAnswerId": "o1",
    "explanationCorrect": "S3 Cross-Region Replication automatically copies new objects to a bucket in another Region, giving you a geographically separate copy for disaster recovery.",
    "explanationIncorrect": "Versioning within one Region protects against overwrites but does not survive a Region-wide event. EBS snapshots apply to block volumes, not S3 buckets. A manual copy to an EC2 disk is neither automatic nor durable. Cross-Region durability for S3 is CRR.",
    "tags": [
      "resilience",
      "s3",
      "cross-region-replication"
    ]
  },
  {
    "id": "saa-019",
    "exam": "aws-solutions-architect-associate",
    "domain": "Design Resilient Architectures",
    "difficulty": "hard",
    "stem": "You need a DynamoDB table that is active in multiple Regions with low-latency local reads and writes and automatic multi-Region replication. Which feature provides this?",
    "options": [
      {
        "id": "o1",
        "text": "DynamoDB global tables"
      },
      {
        "id": "o2",
        "text": "A single-Region table with on-demand capacity"
      },
      {
        "id": "o3",
        "text": "DynamoDB Accelerator (DAX) alone"
      },
      {
        "id": "o4",
        "text": "Manual export and import between Regions"
      }
    ],
    "correctAnswerId": "o1",
    "explanationCorrect": "DynamoDB global tables replicate a table across multiple Regions with multi-active read/write and automatic replication, delivering low-latency local access and cross-Region resilience.",
    "explanationIncorrect": "A single-Region table, whatever its capacity mode, provides no multi-Region resilience. DAX is an in-memory cache in front of DynamoDB for read latency, not cross-Region replication. Manual export and import is neither continuous nor low-latency. Multi-Region active tables are DynamoDB global tables.",
    "tags": [
      "resilience",
      "dynamodb",
      "global-tables"
    ]
  },
  {
    "id": "saa-020",
    "exam": "aws-solutions-architect-associate",
    "domain": "Design Resilient Architectures",
    "difficulty": "hard",
    "stem": "A company needs near-zero recovery time and keeps a scaled-down but fully functional copy of its workload always running in a second Region, ready to scale up on failover. Which disaster-recovery strategy is this?",
    "options": [
      {
        "id": "o1",
        "text": "Warm standby"
      },
      {
        "id": "o2",
        "text": "Backup and restore"
      },
      {
        "id": "o3",
        "text": "Pilot light with nothing actively serving"
      },
      {
        "id": "o4",
        "text": "A single-AZ deployment"
      }
    ],
    "correctAnswerId": "o1",
    "explanationCorrect": "Warm standby keeps a smaller but running copy of the environment in another Region that can be scaled up quickly, giving low recovery time at moderate cost.",
    "explanationIncorrect": "Backup and restore has the longest recovery time because you rebuild from backups after a disaster. Pilot light keeps only core elements running (like a replicated database) with the rest switched off, so recovery is slower than warm standby. A single-AZ deployment offers no cross-Region recovery at all. An always-running scaled-down copy is warm standby.",
    "tags": [
      "resilience",
      "disaster-recovery",
      "warm-standby"
    ]
  },
  {
    "id": "saa-021",
    "exam": "aws-solutions-architect-associate",
    "domain": "Design Resilient Architectures",
    "difficulty": "medium",
    "stem": "Incoming orders must not be lost if the processing service is temporarily down, and failed messages should be retried and eventually isolated. How do you design the intake?",
    "options": [
      {
        "id": "o1",
        "text": "Put orders on an SQS queue; workers consume them, and a dead-letter queue captures messages that repeatedly fail"
      },
      {
        "id": "o2",
        "text": "Call the processing service synchronously and drop the order if it is unavailable"
      },
      {
        "id": "o3",
        "text": "Hold orders in the web server's memory until processing recovers"
      },
      {
        "id": "o4",
        "text": "Write each order to a single EC2 instance's local disk"
      }
    ],
    "correctAnswerId": "o1",
    "explanationCorrect": "An SQS queue durably holds orders until workers can process them, decoupling intake from processing, and a dead-letter queue isolates messages that fail repeatedly so they can be inspected without blocking others.",